{
  "schema_version": "1.0.0",
  "catalog_id": "terraflux-system-preset-catalog",
  "purpose": "Oferecer uma rota configuravel e rastreavel para cada parametro do projeto: padrao E0 do sistema, modelo real selecionavel ou valor proprio do cliente, sem transformar referencia publica em evidencia executiva.",
  "contracts": {
    "parameter_catalog_revision": "terraflux-project-parameter-catalog-1.2.0",
    "acquisition_catalog_revision": "terraflux-input-acquisition-catalog-1.0.0",
    "reference_model_catalog_revision": "terraflux-sugarcane-reference-model-catalog-1.0.0",
    "reference_model_catalog_ref": "config/catalogo_modelos_reais_cana.json"
  },
  "selection_policy": {
    "default_application": "E0_ONLY_UNLESS_REPLACED_BY_PROJECT_EVIDENCE",
    "rules": [
      "system defaults never promote project readiness above E0",
      "a selected regional method must match the project jurisdiction and applicability",
      "an OEM model is a nominal prior until the exact unit and configuration are measured",
      "unbound parameters become explicit local input templates instead of invented values",
      "custom values are always allowed when unit, schema and provenance are valid",
      "fail-closed values prevail while safety, permission or approval evidence is missing"
    ]
  },
  "package_profiles": [
    {
      "package_id": "SCOPE_BOUNDARY_PERMISSION",
      "default_model_ids": ["SYS-SCOPE-CLOSED-E0"],
      "selectable_model_ids": ["SYS-SCOPE-CLOSED-E0", "SYS-ENV-LEGAL-OFFICIAL-DISCOVERY-E0"],
      "unbound_parameter_policy": "FAIL_CLOSED_OR_LOCAL_INPUT_TEMPLATE",
      "custom_mode": {"enabled": true, "preserve_provenance": true, "validate_against_parameter_schema": true},
      "default_reason": "Continuidade entre talhoes ou propriedades permanece desligada ate identificacao e permissao explicitas.",
      "release_effect": "DOES_NOT_RESOLVE_PROJECT_EVIDENCE"
    },
    {
      "package_id": "SURVEY_VERTICAL",
      "default_model_ids": ["SYS-VERTICAL-IBGE-HGEOHNOR2020-E0"],
      "selectable_model_ids": ["SYS-VERTICAL-IBGE-HGEOHNOR2020-E0"],
      "unbound_parameter_policy": "LOCAL_INPUT_TEMPLATE",
      "custom_mode": {"enabled": true, "preserve_provenance": true, "validate_against_parameter_schema": true},
      "default_reason": "O referencial brasileiro e o modelo de conversao orientam a coleta, mas checkpoints independentes continuam obrigatorios.",
      "release_effect": "DOES_NOT_RESOLVE_PROJECT_EVIDENCE"
    },
    {
      "package_id": "TERRAIN_SURFACE_CONTEXT",
      "default_model_ids": ["SYS-TERRAIN-LAZ-DTM-TEMPLATE"],
      "selectable_model_ids": ["SYS-TERRAIN-LAZ-DTM-TEMPLATE"],
      "unbound_parameter_policy": "LOCAL_INPUT_TEMPLATE",
      "custom_mode": {"enabled": true, "preserve_provenance": true, "validate_against_parameter_schema": true},
      "default_reason": "O fluxo padrao parte de LAS/LAZ ou MDT auditavel e exige envelope e breaklines do projeto.",
      "release_effect": "DOES_NOT_RESOLVE_PROJECT_EVIDENCE"
    },
    {
      "package_id": "AGRONOMIC_CONFIGURATION",
      "default_model_ids": ["SYS-CANA-ROW-SIMPLE-1P50-E0", "SYS-CANA-VARIETY-CENSUS-CS-2024-E0"],
      "selectable_model_ids": ["SYS-CANA-ROW-SIMPLE-1P50-E0", "SYS-CANA-ROW-DOUBLE-0P90X1P50-E0", "SYS-CANA-ROW-DOUBLE-0P40X1P50-E0", "SYS-CANA-VARIETY-CENSUS-CS-2024-E0", "OEM-ANTONIOSI-PCP1102", "OEM-JD-CH670-TRACK-2ROW-ALT", "OEM-JD-CH950-TRACK-2ROW", "OEM-CIVEMASA-SATP-HD-2R"],
      "unbound_parameter_policy": "LOCAL_INPUT_TEMPLATE",
      "custom_mode": {"enabled": true, "preserve_provenance": true, "validate_against_parameter_schema": true},
      "default_reason": "O espacamento simples de 1,50 m e uma referencia publicada como usual na colheita mecanizada; variedade e arranjo final continuam zonais e locais.",
      "release_effect": "DOES_NOT_RESOLVE_PROJECT_EVIDENCE"
    },
    {
      "package_id": "YIELD_LOAD_EVENTS",
      "default_model_ids": ["SYS-YIELD-CONAB-BR-2026-27-E0"],
      "selectable_model_ids": ["SYS-YIELD-CONAB-BR-2026-27-E0", "SYS-YIELD-CONAB-SE-2026-27-E0", "SYS-YIELD-CONAB-CO-2026-27-E0", "SYS-YIELD-CONAB-NE-2026-27-E0"],
      "unbound_parameter_policy": "LOCAL_INPUT_TEMPLATE",
      "custom_mode": {"enabled": true, "preserve_provenance": true, "validate_against_parameter_schema": true},
      "default_reason": "A media Brasil da Conab serve somente para sensibilidade E0; regioes podem selecionar a estimativa regional e projetos liberados usam mapa ou massa calibrada.",
      "release_effect": "DOES_NOT_RESOLVE_PROJECT_EVIDENCE"
    },
    {
      "package_id": "SOIL_PROFILE_HYDRAULIC",
      "default_model_ids": ["SYS-SOIL-PUBLIC-PREFILL-E0"],
      "selectable_model_ids": ["SYS-SOIL-PUBLIC-PREFILL-E0", "SYS-SOIL-CAMPAIGN-EMBRAPA-TEMPLATE", "SYS-CONSERVATION-EMBRAPA-DOC480-FIELD-CAL"],
      "unbound_parameter_policy": "LOCAL_INPUT_TEMPLATE",
      "custom_mode": {"enabled": true, "preserve_provenance": true, "validate_against_parameter_schema": true},
      "default_reason": "Mapas publicos fazem pre-classificacao; perfil, erodibilidade e comportamento hidraulico exigem campanha local rastreada.",
      "release_effect": "DOES_NOT_RESOLVE_PROJECT_EVIDENCE"
    },
    {
      "package_id": "SOIL_OPERATION_STATE",
      "default_model_ids": ["SYS-SOIL-OPERATION-LOCAL-TEMPLATE"],
      "selectable_model_ids": ["SYS-SOIL-OPERATION-LOCAL-TEMPLATE"],
      "unbound_parameter_policy": "FAIL_CLOSED_OR_LOCAL_INPUT_TEMPLATE",
      "custom_mode": {"enabled": true, "preserve_provenance": true, "validate_against_parameter_schema": true},
      "default_reason": "Umidade, trafegabilidade e suporte de carga variam no tempo e devem ser observados localmente.",
      "release_effect": "DOES_NOT_RESOLVE_PROJECT_EVIDENCE"
    },
    {
      "package_id": "RAINFALL_DESIGN",
      "default_model_ids": ["SYS-RAIN-SGB-IDF-AUTO-E0"],
      "selectable_model_ids": ["SYS-RAIN-SGB-IDF-AUTO-E0", "SYS-CONSERVATION-EPAGRI-HIDROTERRACO"],
      "unbound_parameter_policy": "LOCAL_INPUT_TEMPLATE",
      "custom_mode": {"enabled": true, "preserve_provenance": true, "validate_against_parameter_schema": true},
      "default_reason": "O sistema busca IDF oficial do SGB por localizacao; periodo de retorno e chuva de projeto continuam escolhas tecnicas aprovadas.",
      "release_effect": "DOES_NOT_RESOLVE_PROJECT_EVIDENCE"
    },
    {
      "package_id": "FULL_CATCHMENT",
      "default_model_ids": ["SYS-CATCHMENT-ANA-BHO6-E0"],
      "selectable_model_ids": ["SYS-CATCHMENT-ANA-BHO6-E0", "SYS-CONSERVATION-ANA-PPA-V5-PROCESS", "SYS-CONSERVATION-ESD-PROCESS-CLOSED"],
      "unbound_parameter_policy": "LOCAL_INPUT_TEMPLATE",
      "custom_mode": {"enabled": true, "preserve_provenance": true, "validate_against_parameter_schema": true},
      "default_reason": "A BHO6 fornece contexto inicial; a microbacia completa, entradas externas e exutorios precisam ser confirmados no projeto.",
      "release_effect": "DOES_NOT_RESOLVE_PROJECT_EVIDENCE"
    },
    {
      "package_id": "DRAINAGE_NETWORK",
      "default_model_ids": ["SYS-DRAINAGE-ASSET-CENSUS-TEMPLATE"],
      "selectable_model_ids": ["SYS-DRAINAGE-ASSET-CENSUS-TEMPLATE", "SYS-CONSERVATION-ANA-PPA-V5-PROCESS", "SYS-CONSERVATION-EPAGRI-HIDROTERRACO", "SYS-CONSERVATION-ESD-PROCESS-CLOSED", "SYS-CONSERVATION-EMBRAPA-DOC483-ASBUILT-OM", "SYS-ROAD-DNIT-CONTEXT-TEMPLATE"],
      "unbound_parameter_policy": "FAIL_CLOSED_OR_LOCAL_INPUT_TEMPLATE",
      "custom_mode": {"enabled": true, "preserve_provenance": true, "validate_against_parameter_schema": true},
      "default_reason": "Todo receptor, canal, bueiro, travessia e saida deve ser inventariado; ausencia de vistoria mantem capacidade e conectividade nao revisadas.",
      "release_effect": "DOES_NOT_RESOLVE_PROJECT_EVIDENCE"
    },
    {
      "package_id": "CONSERVATION_RULE_PACK",
      "default_model_ids": ["SYS-CONSERVATION-ANA-PPA-V5-PROCESS"],
      "selectable_model_ids": ["SYS-CONSERVATION-ANA-PPA-V5-PROCESS", "SYS-CONSERVATION-IAC-BT216-SP-CANA", "SYS-CONSERVATION-PR-BT71-CANA-PCE", "SYS-CONSERVATION-EPAGRI-HIDROTERRACO", "SYS-CONSERVATION-UFV-TERRACO41-PARITY", "SYS-CONSERVATION-ESD-PROCESS-CLOSED", "SYS-CONSERVATION-EMBRAPA-DOC480-FIELD-CAL", "SYS-GOV-SP-SAA-CONSERVATION", "SYS-GOV-PR-PROSOLO"],
      "unbound_parameter_policy": "LOCAL_INPUT_TEMPLATE",
      "custom_mode": {"enabled": true, "preserve_provenance": true, "validate_against_parameter_schema": true},
      "default_reason": "O processo nacional da ANA e o ponto de partida neutro; regras dimensionais so entram por pack regional e aprovacao profissional.",
      "release_effect": "DOES_NOT_RESOLVE_PROJECT_EVIDENCE"
    },
    {
      "package_id": "SUBSURFACE_HYDROLOGY",
      "default_model_ids": ["SYS-SUBSURFACE-ASSESSMENT-TEMPLATE"],
      "selectable_model_ids": ["SYS-SUBSURFACE-ASSESSMENT-TEMPLATE"],
      "unbound_parameter_policy": "LOCAL_INPUT_TEMPLATE",
      "custom_mode": {"enabled": true, "preserve_provenance": true, "validate_against_parameter_schema": true},
      "default_reason": "Surgencias, lençol, drenos e camadas restritivas precisam de investigacao local.",
      "release_effect": "DOES_NOT_RESOLVE_PROJECT_EVIDENCE"
    },
    {
      "package_id": "FLEET_IDENTITY_GEOMETRY",
      "default_model_ids": ["SYS-FLEET-UNSELECTED-CLOSED"],
      "selectable_model_ids": ["SYS-FLEET-UNSELECTED-CLOSED", "OEM-JD-CH570-TRACK-1ROW", "OEM-CASE-AUSTOFT9000-1ROW-WHEEL", "OEM-JD-CH670-TRACK-2ROW-ALT", "OEM-JD-CH950-TRACK-2ROW", "OEM-JD-6210M-TRACTOR", "OEM-CIVEMASA-TAC10500", "OEM-CIVEMASA-TAC22000-REV08", "OEM-ANTONIOSI-PCP1102", "OEM-CIVEMASA-SATP-HD-2R", "OEM-SCANIA-G560-6X4-XT-CANE", "OEM-RANDON-CANE-9AXLE-74T"],
      "unbound_parameter_policy": "FAIL_CLOSED_OR_LOCAL_INPUT_TEMPLATE",
      "custom_mode": {"enabled": true, "preserve_provenance": true, "validate_against_parameter_schema": true},